Title,Probability,Reasoning,Open Access PDF URL
"""do anything now"": characterizing and evaluating in-the-wild jailbreak prompts on large language models",7,"The paper provides valuable insights into jailbreak prompts, which are a specific type of adversarial prompt that attempts to circumvent the safeguards of large language models. Understanding the characteristics and evaluation of these prompts is relevant to prompt engineering because it guides the development of prompts that can resist misuse and prompts that align better with human values. Although it focuses on the adversarial aspect rather than constructive prompt engineering, the findings can inform the broader field of prompt engineering, particularly in designing robust and safe systems. Therefore, the study is quite relevant but not entirely centered on prompt engineering in its purest form, hence the rating of 7.",https://arxiv.org/pdf/2308.03825
latent jailbreak: a benchmark for evaluating text safety and output robustness of large language models,9,"The paper focuses on evaluating the safety and robustness of large language models (LLMs) using a benchmark that entails analysis of prompt design, which is highly relevant to prompt engineering. Specifically, it investigates how malicious instructions embedded within prompts affect the LLM's behavior. This is crucial for understanding how different prompt structures (position of instructions, word replacements, and instruction replacements) influence the model's output, aligning closely with the broader field of prompt engineering that aims to optimize the interaction with LLMs. The systematic review mentioned in the query would likely cover such research, as it is integral to understanding how 'hard prefixes' or fixed parts of prompts can affect the LLM's outputs. The only reason it does not get a full 10 is because the study does not solely focus on the engineering aspect of prompts but also on the safety and ethical concerns related to prompts.",https://arxiv.org/pdf/2307.08487
fuzzllm: a novel and universal fuzzing framework for proactively discovering jailbreak vulnerabilities in large language models,7,"The relevance of 'fuzzllm: a novel and universal fuzzing framework for proactively discovering jailbreak vulnerabilities in large language models' to prompt engineering is notable. While the primary focus is on discovering vulnerabilities through fuzz testing, the utilization of templates to understand the structure of prompts and the identification of features within these prompts are directly related to the study of prompt engineering. The process of ensuring that prompts do not lead to service guideline violations requires a deep understanding of how different prompts are constructed and how they interact with LLMs. Therefore, the research indirectly contributes to the field of prompt engineering by seeking ways to prevent manipulative prompts from eliciting undesired responses. However, the study does not directly address hard prefix prompts or the systematic review of such prompts, which would be more central to a targeted prompt engineering study.",https://arxiv.org/pdf/2309.05274
"tricking llms into disobedience: understanding, analyzing, and preventing jailbreaks",8,"The study is highly relevant to prompt engineering as it addresses the manipulation of prompts to achieve unintended model behaviors, which is a critical aspect of prompt design and engineering. Understanding how to prevent these 'jailbreaks' is crucial for developing more secure and reliable prompt engineering practices. The study provides insights into the vulnerabilities of current models and offers potential solutions, which directly contribute to the field of prompt engineering. The rating is not a full 10 because the study is more focused on security and mitigation rather than the broader aspects of prompt engineering, such as the optimization of prompts for various tasks or the generation of more sophisticated prompts for improved performance.",http://arxiv.org/pdf/2305.14965
jailbreaking black box large language models in twenty queries,8,"The abstract discusses an algorithm (PAIR) for generating 'semantic jailbreaks' using adversarial methods on large language models (LLMs) such as GPT-3.5/4, Vicuna, and PaLM-2. This is highly relevant to prompt engineering because understanding and preventing adversarial manipulation of LLMs is crucial for developing more effective and secure prompts. It is directly related to the field as it explores the vulnerabilities in the current engineering of prompts and how they can be exploited. The abstract, however, does not specifically address 'hard prefix prompts', which are a subset of prompts within prompt engineering, hence not warranting a full score of 10.",https://arxiv.org/pdf/2310.08419
visual prompt tuning,7,"The topic of Visual Prompt Tuning (VPT) is relevant to the prompt engineering study since it deals with the adaptation of pre-trained models, which is a core concept in prompt engineering. However, VPT specifically addresses the visual domain and large-scale Transformer models in vision, which differs from the 'hard prefix prompts' that typically relate to textual input. Despite this difference, the underlying principles of efficient tuning and the introduction of new parameters to influence model behavior without extensive retraining are concepts shared with prompt engineering. This cross-domain relevance is valuable but not directly tied to the initial study of 'hard prefix prompts', hence the rating of 7.",http://arxiv.org/pdf/2203.12119
conditional prompt learning for vision-language models,7,"The abstract describes a study that focuses on prompt learning, specifically in vision-language models, which is highly relevant to the field of prompt engineering. The study introduces Conditional Context Optimization (CoCoOp), which is a method for improving the generalization of learned prompts over unseen classes. While this is directly related to prompt engineering, it is specifically tailored to vision-language models, and not directly focused on 'hard prefix prompts' which the original prompt suggests. Therefore, the relevance rating is not a perfect 10, as 'hard prefix prompts' might imply a different subset of prompt engineering concerned with text prompts in NLP. Nevertheless, the concepts studied are transferable to prompt engineering more broadly, warranting a relatively high rating.",https://arxiv.org/pdf/2203.05557
prompt-to-prompt image editing with cross attention control,8,"The provided abstract describes a study closely related to 'prompt engineering,' as it involves a framework for editing images using text prompts, which directly entails understanding and manipulating prompts for precise outcomes. The emphasis on cross-attention layers as a mechanism for controlling the relationship between text prompts and the spatial layout of images is particularly relevant to the field of prompt engineering, as it is concerned with the fine-tuned influence of textual input on generative models. While the study is not specifically about 'hard prefix prompts,' it contributes to the broader field of prompt engineering by showing how textual prompts can be used to control and manipulate the output of synthesis models. The 2-point deduction accounts for the specific focus on imagery rather than a systematic review of hard prefix prompts in various contexts.",http://arxiv.org/pdf/2208.01626
p-tuning: prompt tuning can be comparable to fine-tuning across scales and tasks,9,"The provided abstract is highly relevant to prompt engineering study as it discusses 'prompt tuning', which is a method within the field of prompt engineering in natural language understanding (NLU). It compares prompt tuning with fine-tuning, highlighting its efficiency and effectiveness across different tasks and model scales, and introduces an advanced version named 'P-Tuning v2'. This research contributes to the understanding of how continuous prompts can be optimized and sheds light on prompt engineering as a potentially universal method for NLU tasks, making it a significant resource for studying prompt engineering methods.",https://aclanthology.org/2022.acl-short.8.pdf
"pre-train, prompt, and predict: a systematic survey of prompting methods in natural language processing",9,"The article provides a detailed survey of prompt-based learning in natural language processing, which is directly relevant to prompt engineering. It covers the adaptation of language models to new tasks using prompts, which is a core concept in prompt engineering. The systematic review and organization of research along with the introduction of a unified set of mathematical notations for existing work are valuable for understanding the breadth and depth of prompt-based methods, making it highly relevant to the study of prompt engineering. Moreover, the article's release of resources like NLPedia–Pretrain aids further research and accessibility. The rating is not a perfect 10 because it might not exclusively focus on 'hard prefix prompts' as the prompt engineering study inquires but generally covers prompting methods in NLP.",https://dl.acm.org/doi/pdf/10.1145/3560815
learning to prompt for open-vocabulary object detection with vision-language model,8,"The abstract details a novel method, detection prompt (DetPro), which focuses on learning continuous prompts for open-vocabulary object detection, indicating an application of prompt engineering in vision-language models. The relevance is high because it directly tackles the challenge of designing effective prompts to improve model performance. However, it might not cover the theoretical foundations or a wider range of prompt engineering applications, hence not a full score.",https://arxiv.org/pdf/2203.14940
an information-theoretic approach to prompt engineering without ground truth labels,9,"The article presents a technique for prompt engineering, which is highly relevant to the study of prompt engineering. It focuses on a method that maximizes mutual information between input and output to select effective prompts without labeled data or model access. This method is innovative in the field of prompt engineering as it bypasses the need for substantial labeled datasets and the necessity to tweak model parameters. However, the title does not specifically mention 'hard prefix prompts,' so it may not be entirely focused on 'hard prefix prompts' as the type of prompts being engineered, which is why it doesn't receive a perfect 10.",https://www.cambridge.org/core/services/aop-cambridge-core/content/view/035D7C8A55B237942FB6DBAD7CAA4E49/S1047198723000025a.pdf/div-class-title-out-of-one-many-using-language-models-to-simulate-human-samples-div.pdf
prompt distribution learning,9,"The abstract and TLDR indicate that the study deals with prompt distribution learning, which is directly related to prompt engineering. It focuses on adapting pre-trained models to downstream tasks by learning prompt distributions, a technique relevant to constructing and using prompts to improve model performance. This is highly pertinent to studies in prompt engineering, which aims to optimize how models interact with prompts for better task performance. Although the term 'hard prefix prompts' is not explicitly mentioned, the overall concept of learning and utilizing prompts makes this study considerably relevant.",https://arxiv.org/pdf/2205.03340
ignore previous prompt: attack techniques for language models,8,"The provided abstract is highly relevant to the subject of 'prompt engineering,' as it directly discusses PromptInject, a methodology for adversarial prompt composition designed to exploit vulnerabilities in transformer-based language models like GPT-3. This pertains to the broader category of prompt engineering by showcasing methods of prompting that could lead to model misalignment, thus revealing long-tail risks. Understanding these attack techniques is crucial for developing more robust prompt engineering practices, although the specific focus on 'hard prefix prompts' is not directly mentioned.",https://arxiv.org/pdf/2211.09527
language models that seek for knowledge: modular search & generation for dialogue and prompt completion,7,"While the abstract provided doesn't directly address 'hard prefix prompts' or 'prompt engineering' specifically, it does pertain to the broader subject area of how language models can be improved to generate more factual and relevant responses. The research on modular search and generation in the context of dialogue and prompt completion is relevant to prompt engineering as it impacts the effectiveness of the prompts in eliciting accurate and meaningful responses from language models. Therefore, the rating is relatively high due to the indirect relevance of improving language model outputs, which is a fundamental aspect of prompt engineering.",http://arxiv.org/pdf/2203.13224
test-time prompt tuning for zero-shot generalization in vision-language models,9,"The abstract describes a study directly related to prompt engineering, specifically the dynamic tuning of prompts for vision-language models to enhance zero-shot generalization. Although the provided text doesn't explicitly mention 'hard prefix prompts,' it discusses an advanced concept of prompt optimization at test-time which is highly relevant to the broader field of prompt engineering. The method's ability to adapt prompts using a single test sample fits well within the study of how prompts can be engineered and optimized to improve model performance, particularly in zero-shot settings.",http://arxiv.org/pdf/2209.07511
diffusiondb: a large-scale prompt gallery dataset for text-to-image generative models,8,"The abstract describes a dataset (DiffusionDB) focused on the synthesis of text-to-image generation using prompts in natural language, which includes the study of syntactic and semantic characteristics of prompts. This relates closely to prompt engineering, as it involves analyzing how prompts influence the outputs of generative models and finding optimal prompts to achieve desired results. The only reason it does not score a perfect 10 is because 'hard prefix prompts' which the initial prompt specified are not mentioned, so it may not cover the specific focus on 'hard prefix prompts'. Nonetheless, it is highly relevant for studies about prompt engineering in the broader context of text-to-image generative models.",https://arxiv.org/pdf/2210.14896
learning to prompt for continual learning,8,"The abstract discusses an approach to continual learning that focuses on using prompts as learnable parameters within a memory space to guide model predictions and manage knowledge. This is highly relevant to prompt engineering because it directly deals with the optimization and efficacy of prompts in a machine learning context. However, it is not a 'comprehensive systematic review on hard prefix prompts,' as the prompt specifies, but rather a presentation of a novel framework for continual learning using prompts, which is why the rating is not a perfect 10.",https://arxiv.org/pdf/2112.08654
prompt-aligned gradient for prompt tuning,9,"The abstract describes a study focused on improving prompt tuning methods for vision-language models, presenting a new approach called Prompt-aligned Gradient (ProGrad) specifically designed to prevent the loss of general knowledge during the fine-tuning process. This is highly relevant to prompt engineering as it addresses a significant challenge in the field—maintaining the balance between task-specific adaptation and the retention of pre-trained capabilities. The paper shows potential advancements in prompt tuning, which is a core aspect of prompt engineering, hence the high relevance rating.",https://arxiv.org/pdf/2205.14865
hyperprompt: prompt-based task-conditioning of transformers,9,"The provided text is highly relevant to prompt engineering study as it directly addresses a novel architecture called 'HyperPrompt' for prompt-based task-conditioning in Transformers, which is a key area in the field of prompt engineering. The text discusses the efficiency and effectiveness of HyperPrompt in the context of few-shot learning and multi-task learning, benchmarks that are essential for evaluating prompt-based methods. The relevance is not rated a full 10 only because the specific term 'hard prefix prompts' is not directly mentioned, although the description strongly suggests relevance to that concept.",https://arxiv.org/pdf/2203.00759
prompt for extraction? paie: prompting argument interaction for event argument extraction,8,"The provided abstract describes a model (PAIE) that leverages prompt tuning as part of its methodology for Event Argument Extraction (EAE). The model's use of prompts to guide span selection and capture argument interactions is highly relevant to the study of prompt engineering, as it applies prompt-based methods for a specific NLP task. The paper also discusses extractive prompt tuning strategies and their effectiveness, which contributes to the understanding of prompt engineering. However, it does not specifically address 'hard prefix prompts' which might be a more specialized aspect within the field of prompt engineering, hence the rating isn't a full 10.",https://aclanthology.org/2022.acl-long.466.pdf
promda: prompt-based data augmentation for low-resource nlu tasks,8,"The paper's focus on 'Prompt-based Data Augmentation' and the method of training 'small-scale Soft Prompts' in PLMs directly relates to the concept of prompt engineering, a technique used to interface with and extract specific behaviors from language models. While the paper might not explicitly cover a 'hard prefix prompt,' it does deal with the broader topic of how prompts can be engineered and utilized to improve NLU tasks, which makes it highly relevant to studies within prompt engineering.",https://aclanthology.org/2022.acl-long.292.pdf
no more fine-tuning? an experimental evaluation of prompt tuning in code intelligence,8,"The abstract discusses prompt tuning as an alternative to fine-tuning in the context of code intelligence tasks. Prompt tuning is highly relevant to prompt engineering studies since it involves designing and inserting prompts that aid the pre-trained models in adapting to specific tasks. This specific paper evaluates the efficiency of prompt tuning over fine-tuning, which is a core topic within prompt engineering research. Although it focuses on code intelligence tasks and not 'hard prefix prompts' specifically, the principles and findings can have implications for prompt engineering in general. The relevance could be higher if the study specifically addressed hard prefix prompts or a broader range of prompt engineering techniques.",https://arxiv.org/pdf/2207.11680
personalized prompt learning for explainable recommendation,8,"The given title and abstract focus on 'prompt learning', particularly in the context of explainable recommendation systems. It is highly relevant to prompt engineering since prompt learning is a crucial aspect of tailoring prompts to improve the performance of AI models, such as pre-trained transformer models mentioned in the text. Moreover, the paper discusses innovative approaches (discrete and continuous prompt learning) and training strategies, which are essential for advancing the field of prompt engineering. The rating is not a full 10 because the study specifically addresses the use of prompt learning for explainable recommendations rather than a broad systematic review on 'hard prefix prompts' in general, implying a more focused domain application rather than a comprehensive study across multiple domains or types of prompts.",https://arxiv.org/pdf/2202.07371
towards unified conversational recommender systems via knowledge-enhanced prompt learning,7,"The abstract discusses the integration of recommendation and conversation modules in a conversational recommender system using a prompt learning paradigm, which is particularly relevant to prompt engineering. The use of knowledge-enhanced prompts and the unification of different subtasks into the prompt learning framework makes it pertinent to the study of how prompts can be designed to improve performance in AI systems. Although the primary focus is on conversational recommender systems rather than prompt engineering in general, the methodology and implications for the field of prompt engineering are significant enough to warrant a relevance rating of 7.",https://arxiv.org/pdf/2206.09363
bridge-prompt: towards ordinal action understanding in instructional videos,7,"The paper describes an approach that involves 'reformulating individual action labels as integrated text prompts,' which relates to the concept of incorporating linguistic structures (prompts) to enhance the understanding of actions in videos. This suggests an innovative use of prompt engineering to bridge the semantic gap between actions, which is relevant to the study of prompts in the context of machine learning. However, this application is specific to action recognition in video data and does not address 'hard prefix prompts' directly, which is why the relevance rating is not higher.",https://arxiv.org/pdf/2203.14104
prompt consistency for zero-shot task generalization,9,"The title and abstract describe a study focused on improving zero-shot task generalization by regularizing prompt consistency, which is highly relevant to prompt engineering. Prompt engineering involves the careful design of prompts to elicit the desired responses from language models, and this paper directly addresses and proposes a method for enhancing performance in this area. The relevance is not rated a full 10 because the study may not explicitly be about 'hard prefix prompts' as mentioned in the primary query but it does contribute significantly to the broader field of prompt engineering.",http://arxiv.org/pdf/2205.00049
promptcap: prompt-guided task-aware image captioning,8,"The article describes 'PromptCap', a model that utilizes natural-language prompts to generate image captions that are tailored to assist large language models in performing visual question answering tasks. While the primary focus is on image captioning to aid knowledge-based VQA, the use of prompts to guide the model's output is directly related to prompt engineering. The research showcases how carefully engineered prompts can significantly enhance the performance of language models in understanding and responding to visual content. Therefore, the study has high relevance to prompt engineering, particularly in the context of integrating textual and visual information. However, it does not directly address hard prefix prompts in a systematic review, which is why the rating is not a perfect 10.",https://arxiv.org/pdf/2211.09699
spot: better frozen model adaptation through soft prompt transfer,9,"The abstract describes a study directly relevant to prompt engineering, as it focuses on the use of prompts to enhance performance in natural language processing tasks through a method known as Soft Prompt Transfer (SPoT). The relevance is high because it involves leveraging soft prompts for model adaptation which is a specific aspect of prompt engineering. Moreover, it suggests a systematic approach to understanding task transferability, which can contribute significant insights into the field of prompt engineering. The only reason it does not receive a full 10 is that the abstract does not mention 'hard prefix prompts' which was the specific focus of the systematic review mentioned in the prompt.",https://aclanthology.org/2022.acl-long.346.pdf
prompt programming for large language models: beyond the few-shot paradigm,9,"The abstract discusses advanced concepts in prompt programming and evaluates the effectiveness of 0-shot prompts in comparison to few-shot prompts using GPT-3. It underlines the significant impact of prompt design on language model performance and outcomes. The introduction of 'metaprompt' suggests a forward-thinking approach in prompt engineering, indicating a relevance to the study of prompt engineering. The score is not a perfect 10 because the abstract doesn't specifically mention 'hard prefix prompts,' but the overall discussion is highly pertinent to the field of prompt engineering.",https://arxiv.org/pdf/2102.07350
coda-prompt: continual decomposed attention-based prompting for rehearsal-free continual learning,9,"The paper is highly relevant to the field of prompt engineering as it discusses a novel approach for producing dynamic prompts through an attention-based key-query mechanism, specifically for continual learning in computer vision. This study directly addresses the issue of prompt generation in the context of large-scale pre-trained models and presents a solution for improving accuracy without the need for data rehearsal. Although it may not exclusively focus on 'hard prefix prompts', the concept of input-conditioned prompt components is a valuable contribution to prompt engineering studies, making it almost entirely pertinent to the field.",https://arxiv.org/pdf/2211.13218
